3739,2022-06-21 10:44:26,COM-1652,Canadian Utilities,CAN,Company,CA1367178326,No,http://www.canadianutilities.com,Net zero,,,,,,,,2050.0,In corporate strategy,2022.0,Other,,,,,,,2030 esg targets and roadmap to net zero - supporting the energy transition and reducing ghg emissions,2030.0,"""In January 2022, we announced an initial set of 2030 ESG targets. Our 2030 ESG targets include reducing our operational greenhouse gas (GHG) intensity and customer emissions, growing our renewable energy footprint and transitional products, increasing economic benefits for Indigenous partners, continuing our focus on safety, and further promoting diversity, equity and inclusion in the workplace"" (sustainability 2021 report, pg. 8)","""Reducing net operational GHG emissions to earnings intensity by 30 per cent (Scope 1 and 2). Reducing our customers’ GHG emissions by 2 million tonnes through continued participation in renewable energy, cleaner fuels, energy efficiency and energy infrastructure and storage projects. Owning, developing or managing over 1,000-megawatts (MW) of renewable energy. Deriving 20 per cent of revenues from transitional product categories (e.g., renewable natural gas and hydrogen)."" (sustainability 2021 report, pg. 8)","Reduce GHG emissions and develop renewable energy and infrastructure.

Sustainability report also covers two other atco subsidiaries.",https://www.atco.com/en-ca/our-commitment/sustainability.html,Carbon dioxide and other GHGs,,,,,Yes,Yes,Yes,,"""To ensure we meet our long-term goal of net-zero GHG emissions, we have set a target of reducing our operational GHG emissions to earnings intensity by 30 per cent. At the same time,  we are expanding our disclosure to include Scope 3 emissions. Scope 1 emissions: emissions that we emit directly from our operations, sometimes referred to as direct emissions. Scope 2 emissions: indirect emissions that are produced from purchased energy, such as electricity for our facilities. Scope 3 emissions: indirect emissions upstream and downstream of our operations; for example, customer use of natural gas from our distribution network.""
""We are now also reporting emissions from our energy businesses in two sub-categories of Scope 3 GHG emissions, or emissions in our value chain that we do not directly control but are related to our activities. Scope 3 emissions include 15 sub-categories. For us, almost all our energy businesses’ Scope 3 emissions—over 90 per cent—fall in the categories of Upstream 
production and generation and Downstream end-use. Focusing on these two sub-categories that are most material to our business will allow us to most effectively demonstrate our performance and progression toward our ESG target to reduce our customers’ GHG emissions by 2 million tonnes.  In 2022, we will continue our work to disclose more Scope 3 categories in alignment with TCFD guidelines, focusing on the topics that are most material to our business. We recognize the importance of understanding emissions from our value chain to ensure wemake informed strategic decisions and are as transparent as possible."" (sustainability 2021 report, pg.18)

Further information of emissions: https://www.canadianutilities.com/en-ca.html
",Yes,"Measures for all emission scopes that are covered by the target|Information on the extent to which measures will be applied (e.g. if switching to EVs, what share of the fleet; if installing an own solar PV installation, what is the installed capacity)|Schedule for regular review of measures|Information on the emission reductions expected from these measures within a certain time period",Annual reporting,Yes,,"""A variety of publicly available documents that contain governance, economic, environmental, and social information for 2021, including the Annual Report, Sustainability Report, financial filings, and website"" (sustainability 2021 report, pg.49 - 56). Urls available within these pages.
DEI is strongly valued by the company and indigenous partners share the economic benefits of developments through equity arrangements, revenue sharing, JV partnerships, MOUs and procurement opportunities. Inclusive and Respectful Workforce policy: https://www.atco.com/content/dam/web/about-us/vision-values/how-we-do-business.pdf#page=26",Yes,No conditions specified,,,Yes,"Yes (CCS-based removals e.g. BECCS, DACCS)","""ATCO participates in carbon offset markets in Canada and Australia. We look to reduce emissions where possible, but ATCO may apply these carbon offsets as a transitionary tool to address residual emissions in our portfolio."" (sustainability 2021 report, pg. 15)
""Developing and modernizing infrastructure and storage solutions, including the integration of carbon capture utilization and storage (CCUS)."" (sustainability 2021 report, pg. 9)",,,2900000000.0,,Power generation,,4593.0,,,,
3907,2023-02-22 15:37:40,COM-1820,Kirkland Lake Gold,CAN,Company,JP3248000006,No,,Net zero,,,,,,,,2050.0,In corporate strategy,2021.0,No target,,,,,,,,,,,,https://s23.q4cdn.com/685814098/files/doc_downloads/sustainability/2021/KLGold_GSR_Design_13.pdf,Carbon dioxide and other GHGs,,,,,Yes,Yes,Yes,No,,No,,Annual reporting,No,Not Specified,,Yes,No conditions specified,,,No,No,,,,1400000000.0,,Materials,,2583.0,,,,
